{
  "name": "rate_limited_remaining_2",
  "description": "Calibration: 429 with X-RateLimit-Remaining: 2 (transient burst, not sustained exhaustion). rate_limited fires at the mid tier (0.85).",
  "severity": "low",
  "request": {
    "method": "POST",
    "url": "https://api.acme-co.example/v1/events",
    "headers": {
      "authorization": "Bearer t",
      "content-type": "application/json"
    },
    "body": "{\"event\":\"ping\"}"
  },
  "response": {
    "status": 429,
    "headers": {
      "content-type": "application/json",
      "x-ratelimit-remaining": "2"
    },
    "body": "{\"error\":\"too_many_requests\"}"
  },
  "context": {
    "auth_required": true
  },
  "expected_rule_id": "rate_limited"
}
