{
  "name": "rate_limited_bare",
  "description": "Calibration: 429 response with no rate-limit headers. rate_limited should fire at the lowest tier (0.70).",
  "severity": "low",
  "request": {
    "method": "POST",
    "url": "https://api.acme-co.example/v1/events",
    "headers": {
      "authorization": "Bearer t",
      "content-type": "application/json"
    },
    "body": "{\"event\":\"ping\"}"
  },
  "response": {
    "status": 429,
    "headers": {
      "content-type": "application/json"
    },
    "body": "{\"error\":\"too_many_requests\"}"
  },
  "context": {
    "auth_required": true
  },
  "expected_rule_id": "rate_limited"
}
