{
  "name": "webhook_slack_v0_clean",
  "description": "Slack v0 envelope with a valid signature; both webhook rules must NOT fire.",
  "severity": "low",
  "request": {
    "method": "POST",
    "url": "https://customer.acme-co.example/hooks/slack",
    "headers": {
      "content-type": "application/json",
      "user-agent": "Slackbot 1.0 (+https://api.slack.com/robots)",
      "x-slack-signature": "v0=49417197757b998439de8cb594cb0ce151ffaae62595b8bb605f59f7058d4dcb",
      "x-slack-request-timestamp": "1762704000"
    },
    "body": "{\"event\":\"channel.message\",\"text\":\"hello\"}"
  },
  "response": {
    "status": 200,
    "headers": {
      "content-type": "application/json"
    },
    "body": "{\"ok\":true}"
  },
  "context": {
    "auth_required": false,
    "webhook": {
      "secret_path": "secret.txt",
      "signature_header": "x-slack-signature",
      "timestamp_header": "x-slack-request-timestamp",
      "tolerance_seconds": 300,
      "envelope_format": "slack_v0"
    },
    "now_unix": 1762704060
  },
  "expected_rule_id": null
}
