{
  "name": "webhook_stripe_v1_clean",
  "description": "Stripe-style envelope with a valid v1 signature; both webhook rules must NOT fire.",
  "severity": "low",
  "request": {
    "method": "POST",
    "url": "https://customer.acme-co.example/hooks/stripe",
    "headers": {
      "content-type": "application/json",
      "user-agent": "Stripe/1.0 (+https://stripe.com/docs/webhooks)",
      "stripe-signature": "t=1762704000,v1=f700578c0b5bfcb596260bf652581eabb9c4bc2332d584b99ec8cdaea0be906f"
    },
    "body": "{\"event\":\"order.created\",\"order_id\":\"ord_8KZ\"}"
  },
  "response": {
    "status": 200,
    "headers": {
      "content-type": "application/json"
    },
    "body": "{\"received\":true}"
  },
  "context": {
    "auth_required": false,
    "webhook": {
      "secret_path": "secret.txt",
      "signature_header": "stripe-signature",
      "timestamp_header": "stripe-signature",
      "tolerance_seconds": 300,
      "envelope_format": "stripe_v1"
    },
    "now_unix": 1762704060
  },
  "expected_rule_id": null
}
